{
  "artifactVersion": "0.1.0",
  "id": "874e1b06-6805-47ac-a941-3e83d504009e",
  "projectId": "pilot-citation-reliability",
  "taskId": "T-pilot",
  "task": {
    "id": "T-pilot",
    "owner": "scout",
    "phase": "analyze",
    "question": "What can JSON Schema validation and provenance records establish about citation reliability in a research-agent handoff?",
    "inputs": [
      "sources.json"
    ],
    "expectedOutput": "Cited, qualified brief",
    "acceptanceCriteria": [
      "Cite examined sources",
      "Retain uncertainty and open questions",
      "Disclose evaluation limitations"
    ],
    "status": "active",
    "evidenceIds": [
      "E-001",
      "E-002",
      "E-003"
    ],
    "artifacts": [
      {
        "path": "charter.md",
        "kind": "charter",
        "hash": "6ae91dcbc2957bed44f7c0a8d8f8eb549a4dc5075a8e819598b1d1b1ce639caa"
      },
      {
        "path": "plan.md",
        "kind": "plan",
        "hash": "68ef00317b7de2b08569f1be253c9b2e6adf380d4c657caca4c2918261e7a99e"
      },
      {
        "path": "source-evidence.json",
        "kind": "evidence",
        "hash": "9d80dc54164dc602505d0dd106c593e9c373818b4ad069ce9fec3f245095d8d2"
      }
    ],
    "reopenedFrom": null,
    "blocker": null,
    "unblockCondition": null,
    "review": null,
    "disposition": null
  },
  "fromAgent": "scout",
  "toAgent": "analyst",
  "sourceLock": {
    "lockVersion": 1,
    "protocolVersion": "0.1.0",
    "hashPolicy": "sha256-utf8-bomless-lf-v1",
    "manifestHash": "7b8f61c947d72b33298606a6ef8a1290cebf8ec0a6a4a69bf3ae223c3e6e0526",
    "coreHash": "ae79c652c6e7a8804436c0e6b821562e606b49440677ef4c7335640fcd384862",
    "agents": [
      {
        "id": "scout",
        "modules": [
          "roles/scout",
          "methods/evidence-first"
        ]
      },
      {
        "id": "analyst",
        "modules": [
          "roles/analyst",
          "methods/evidence-first"
        ]
      },
      {
        "id": "reviewer",
        "modules": [
          "roles/reviewer",
          "methods/evidence-first"
        ]
      },
      {
        "id": "synthesist",
        "modules": [
          "roles/synthesist",
          "methods/evidence-first",
          "outputs/research-brief"
        ]
      }
    ],
    "modules": [
      {
        "id": "methods/evidence-first",
        "version": "0.1.0",
        "origin": "builtin:methods/evidence-first.json",
        "hash": "dac06d8d7f7e559a790126410fc304284fce9223125869a4c5d30e42a9127728",
        "fields": {
          "instructions": "3ff7432656f3806d81ba3540079dd03ccda8eb47d21f91f823d6de3f9e467f09",
          "summary": "abb4310be1f233548504b9e3007ac949ee53ea75a7724ab5b74717cc55f27580",
          "requires": "4f53cda18c2baa0c0354bb5f9a3ecbe5ed12ab4d8e11ba873c2f11161202b945",
          "excludes": "4f53cda18c2baa0c0354bb5f9a3ecbe5ed12ab4d8e11ba873c2f11161202b945",
          "capabilities": "fa4ae17337ce651ff3b66b6428151b6f352c50cd95f132ba2a13d00722503a66"
        }
      },
      {
        "id": "outputs/research-brief",
        "version": "0.1.0",
        "origin": "builtin:outputs/research-brief.json",
        "hash": "7d96aaae6802665e620910f5fdf74eb32996bf98fe7f08f146aa1cbc5f8159ac",
        "fields": {
          "instructions": "529a770e9601151d80a7614f1b1f17c5f0f24c5156931e06f2c26c5cae902a85",
          "summary": "6e8930a5c8d23ace7d572a5d6477f3195186cc54e62d7df5f8aee10bc90a2a87",
          "requires": "dbc7c47365caac2cca69d790e4aff2ebf2efe3de8576af2a97ac2a2bab3d122f",
          "excludes": "4f53cda18c2baa0c0354bb5f9a3ecbe5ed12ab4d8e11ba873c2f11161202b945",
          "capabilities": "f08dc124178f4005cda01ac1b39d35571ce1bce9c09315b7ea2ab466dc291ea4"
        }
      },
      {
        "id": "roles/analyst",
        "version": "0.1.0",
        "origin": "builtin:roles/analyst.json",
        "hash": "281e3838432fa6e2f85cc0f725b5030d53041512b870dd66d4655ecf1f434384",
        "fields": {
          "instructions": "f9c01bfd15ca000016c6f76cb8d5455acc1e48a88b2f5dc3482bd3f4b12a8dd0",
          "summary": "65e2567b0ba6048471c1eb5143f95935442b37e4246bd869b4a89f17918de70a",
          "requires": "dbc7c47365caac2cca69d790e4aff2ebf2efe3de8576af2a97ac2a2bab3d122f",
          "excludes": "4f53cda18c2baa0c0354bb5f9a3ecbe5ed12ab4d8e11ba873c2f11161202b945",
          "capabilities": "3ea086d9a22f9fb66c8c8006409984aa8790bad9741bdee6c690aa3e05f548d3"
        }
      },
      {
        "id": "roles/reviewer",
        "version": "0.1.0",
        "origin": "builtin:roles/reviewer.json",
        "hash": "7d543ec8320ed92225a8a2dc887b1c84d1d77a57ff6db6894a1f84e528cc2af2",
        "fields": {
          "instructions": "ae193c5c8e017a2286d12336e364d86087ca4a7f66db8153d7bc42cc2ae62bf6",
          "summary": "8aaa2560888a8f7566357fa69aa576872dbdc0b43e3d1faa34e4cf1b2e2f7745",
          "requires": "dbc7c47365caac2cca69d790e4aff2ebf2efe3de8576af2a97ac2a2bab3d122f",
          "excludes": "4f53cda18c2baa0c0354bb5f9a3ecbe5ed12ab4d8e11ba873c2f11161202b945",
          "capabilities": "3ea086d9a22f9fb66c8c8006409984aa8790bad9741bdee6c690aa3e05f548d3"
        }
      },
      {
        "id": "roles/scout",
        "version": "0.1.0",
        "origin": "builtin:roles/scout.json",
        "hash": "e12e8b58454c96e9f790277f2f4c5b6d95594ebee46632c8d668ed0051c2d875",
        "fields": {
          "instructions": "6f7f4bb7314468639a2c6c43e6fa3eea65f6412b57550280b251126917c9b721",
          "summary": "a117d3b4697b359a5e33d0263968e67b11a76401fe056b473fc16175d2722747",
          "requires": "dbc7c47365caac2cca69d790e4aff2ebf2efe3de8576af2a97ac2a2bab3d122f",
          "excludes": "4f53cda18c2baa0c0354bb5f9a3ecbe5ed12ab4d8e11ba873c2f11161202b945",
          "capabilities": "3ea086d9a22f9fb66c8c8006409984aa8790bad9741bdee6c690aa3e05f548d3"
        }
      },
      {
        "id": "roles/synthesist",
        "version": "0.1.0",
        "origin": "builtin:roles/synthesist.json",
        "hash": "bdf06956e6b8ca5264d75d71653019deae1bac187bbd5f74c3984f25f167e2a0",
        "fields": {
          "instructions": "bda0ebb4542aef2e75fd423fbcb2e30dd736aa92d647b9d225e40b347428a436",
          "summary": "7ebc1c2886280b1e0833e5bb6a232fd03f660f336409da00341319c2006fb42d",
          "requires": "dbc7c47365caac2cca69d790e4aff2ebf2efe3de8576af2a97ac2a2bab3d122f",
          "excludes": "4f53cda18c2baa0c0354bb5f9a3ecbe5ed12ab4d8e11ba873c2f11161202b945",
          "capabilities": "3ea086d9a22f9fb66c8c8006409984aa8790bad9741bdee6c690aa3e05f548d3"
        }
      }
    ]
  },
  "destinationLock": {
    "lockVersion": 1,
    "protocolVersion": "0.1.0",
    "hashPolicy": "sha256-utf8-bomless-lf-v1",
    "manifestHash": "bf9d52afda98328fdb8ceba08f10b6794eff723c190a76dc6ceca9f3c614fa98",
    "coreHash": "ae79c652c6e7a8804436c0e6b821562e606b49440677ef4c7335640fcd384862",
    "agents": [
      {
        "id": "scout",
        "modules": [
          "roles/scout",
          "methods/evidence-first"
        ]
      },
      {
        "id": "analyst",
        "modules": [
          "roles/analyst",
          "methods/evidence-first"
        ]
      },
      {
        "id": "reviewer",
        "modules": [
          "roles/reviewer",
          "methods/evidence-first"
        ]
      },
      {
        "id": "synthesist",
        "modules": [
          "roles/synthesist",
          "methods/evidence-first",
          "outputs/research-brief"
        ]
      }
    ],
    "modules": [
      {
        "id": "methods/evidence-first",
        "version": "0.1.0",
        "origin": "builtin:methods/evidence-first.json",
        "hash": "dac06d8d7f7e559a790126410fc304284fce9223125869a4c5d30e42a9127728",
        "fields": {
          "instructions": "3ff7432656f3806d81ba3540079dd03ccda8eb47d21f91f823d6de3f9e467f09",
          "summary": "abb4310be1f233548504b9e3007ac949ee53ea75a7724ab5b74717cc55f27580",
          "requires": "4f53cda18c2baa0c0354bb5f9a3ecbe5ed12ab4d8e11ba873c2f11161202b945",
          "excludes": "4f53cda18c2baa0c0354bb5f9a3ecbe5ed12ab4d8e11ba873c2f11161202b945",
          "capabilities": "fa4ae17337ce651ff3b66b6428151b6f352c50cd95f132ba2a13d00722503a66"
        }
      },
      {
        "id": "outputs/research-brief",
        "version": "0.1.0",
        "origin": "builtin:outputs/research-brief.json",
        "hash": "7d96aaae6802665e620910f5fdf74eb32996bf98fe7f08f146aa1cbc5f8159ac",
        "fields": {
          "instructions": "529a770e9601151d80a7614f1b1f17c5f0f24c5156931e06f2c26c5cae902a85",
          "summary": "6e8930a5c8d23ace7d572a5d6477f3195186cc54e62d7df5f8aee10bc90a2a87",
          "requires": "dbc7c47365caac2cca69d790e4aff2ebf2efe3de8576af2a97ac2a2bab3d122f",
          "excludes": "4f53cda18c2baa0c0354bb5f9a3ecbe5ed12ab4d8e11ba873c2f11161202b945",
          "capabilities": "f08dc124178f4005cda01ac1b39d35571ce1bce9c09315b7ea2ab466dc291ea4"
        }
      },
      {
        "id": "roles/analyst",
        "version": "0.1.0",
        "origin": "builtin:roles/analyst.json",
        "hash": "281e3838432fa6e2f85cc0f725b5030d53041512b870dd66d4655ecf1f434384",
        "fields": {
          "instructions": "f9c01bfd15ca000016c6f76cb8d5455acc1e48a88b2f5dc3482bd3f4b12a8dd0",
          "summary": "65e2567b0ba6048471c1eb5143f95935442b37e4246bd869b4a89f17918de70a",
          "requires": "dbc7c47365caac2cca69d790e4aff2ebf2efe3de8576af2a97ac2a2bab3d122f",
          "excludes": "4f53cda18c2baa0c0354bb5f9a3ecbe5ed12ab4d8e11ba873c2f11161202b945",
          "capabilities": "3ea086d9a22f9fb66c8c8006409984aa8790bad9741bdee6c690aa3e05f548d3"
        }
      },
      {
        "id": "roles/reviewer",
        "version": "0.1.0",
        "origin": "builtin:roles/reviewer.json",
        "hash": "7d543ec8320ed92225a8a2dc887b1c84d1d77a57ff6db6894a1f84e528cc2af2",
        "fields": {
          "instructions": "ae193c5c8e017a2286d12336e364d86087ca4a7f66db8153d7bc42cc2ae62bf6",
          "summary": "8aaa2560888a8f7566357fa69aa576872dbdc0b43e3d1faa34e4cf1b2e2f7745",